{
  "apiVersion": 1,
  "id": "pr-workspace",
  "name": "PR Workspace",
  "version": "1.0.0",
  "publisher": "Pi Desktop",
  "description": "Browse pull requests, checks, changed files, and per-file patches through your authenticated GitHub CLI.",
  "icon": "↗",
  "order": 40,
  "ui": { "entry": "ui/index.html" },
  "service": {
    "command": "node",
    "args": ["service/main.mjs"]
  }
}
