{
  "apiVersion": 1,
  "id": "code-diff",
  "name": "Code Diff",
  "version": "1.0.0",
  "publisher": "Pi Desktop",
  "description": "Browse per-file working, staged, and last-commit diffs without consuming model tokens.",
  "icon": "±",
  "order": 30,
  "ui": { "entry": "ui/index.html" },
  "service": {
    "command": "node",
    "args": ["service/main.mjs"]
  }
}
