{
  "apiVersion": 1,
  "id": "project-map",
  "name": "Project Map",
  "version": "1.0.0",
  "publisher": "Pi Desktop",
  "description": "Explore repository structure, languages, modules, entry points, and source previews without model tokens.",
  "icon": "⌘",
  "order": 50,
  "ui": { "entry": "ui/index.html" },
  "service": {
    "command": "node",
    "args": ["service/main.mjs"]
  }
}
